"ee_id_show","site","type","title","url","live_url","year","venue","state_country","pitch","ps","imgs","things","status"
5002,1,5,"Flying Foxes","flying-foxes","https://linktr.ee/coryarcangel",2022,"KUNSTVEREIN IN HAMBURG","Hamburg","A show done nxt 2 Majerus, high tension, shaky vibes, 2022 energy, etc, etc. ",,,,"now"
5010,1,1,"the thing is","thething","https://thething.is",2022,"siddharta space, panke.gallery, /rosa","Berlin","show curated and organize by the legandary the thing! ",,,,"now"
5008,1,1,"The Machine is Us","munch",,2022,"MUNCH Triennial","Oslo","Twitter bot 4 carillon ;-)","Hail Mary is a co-commission of FRONT International: Cleveland Triennial for Contemporary Art and MUNCH Triennale.",,,"now"
5009,1,1,"""3-”","3_ropac",,2022,"Galerie Thaddaeus Ropac","Salzburg",,,,,"now"
5011,1,1,"what looks good today may not look good tomorrow","looks-good","https://www.mudam.com/",2022,"MUDAM","Luxembourg","Are.na ramble about Majerus (the king)",,,,
5007,1,1,"Oh, Gods of Dust and Rainbows","oh-gods-of-dust","https://www.frontart.org/",2022,"Front Triennial","Cleveland","Twitter bot 4 carillon ;-)","Hail Mary is a co-commission of FRONT International: Cleveland Triennial for Contemporary Art and MUNCH Triennale.",,,
5006,1,1,"""3-”","3_lisson","https://www.lissongallery.com/exhibitions/cory-arcangel-3",2022,"Lisson Gallery","East Hampton",,,"3--2022-05-web-mw--fAYD.jpg,3--2022-05-web-mw--AfFn.jpg",,
5005,1,5,"Another Romp Thru the IP (Times Square Edit)","romp-ts-arts","http://arts.timessquarenyc.org/times-square-arts/projects/midnight-moment/another-romp-thru-the-ip-times-square-edit/index.aspx",2022,"Times Square","New York","92 billboards in Times Square(!)","Entire Times Square went silent when I wz there!",,,
5004,1,5,"404.lissongallery.com","404-lisson",,2021,"Independent Art Fair (w Lisson Gallery)","New York","2 person show w/ the legends JODI (turned out sick)",,"404.lissongallery.com-2021-XX-web-ih--gVZj.jpg,404.lissongallery.com-2021-XX-web-ih--ioct.jpg,404.lissongallery.com-2021-XX-web-ih--mgF4.jpg,404.lissongallery.com-2021-XX-web-ih--O87W.jpg",,
5001,1,5,"REMIND ME TOMORROW","remind-me-tomorrow","https://issueprojectroom.org/event/remind-me-tomorrow-cory-arcangel-hampus-lindwall-stine-janvin-roc-jim%C3%A9nez-de-cisneros-evol",2021,"Issue Project Room","New York","Huge pipe organ concert co-curated with Hampus Lindwall which took place entirely LIVE inside an iphone. With STINE JANVIN, ROC JIMÉNEZ DE CISNEROS (EVOL), SETH PRICE, AKIRA SILEAS, NILS HENRIK ASHEIM & JOY-LEILANI GARBUTT",,"remind-me-tomorrow-2021-04-web-ih--JANa.jpg,remind-me-tomorrow-2021-04-web-ih--L6bI.jpg,remind-me-tomorrow-2021-04-web-ih--QZYt.jpg,remind-me-tomorrow-2021-04-web-ih--RPyS.jpg,remind-me-tomorrow-2021-04-web-ih--RyR5.jpg,remind-me-tomorrow-2021-04-web-ih--coHR.jpg,remind-me-tomorrow-2021-04-web-ih--eAYD.jpg,remind-me-tomorrow-2021-04-web-ih--rr33.jpg,remind-me-tomorrow-2021-04-web-ih--1Xyl.jpg,remind-me-tomorrow-2021-04-web-ih--ARwk.jpg",,
5000,1,5,"Century 21","century-21","https://conifer.rhizome.org/cory_arcangel/century-21-linktree",2021,"Greene Naftali Gallery","New York","First show in NYC in a trollion years! Wz online and offiline. ",,"c21-2021-03-web-za--Wdl7.jpg,c21-2021-03-web-za--RoMy.jpg,c21-2021-03-web-za--Q0iv.jpg,c21-2021-03-web-za--PkPx.jpg,c21-2021-03-web-za--OGfR.jpg,c21-2021-03-web-za--NITs.jpg,c21-2021-03-web-za--NiTo.jpg,c21-2021-03-web-za--lWNZ.jpg,c21-2021-03-web-za--LM4f.jpg,c21-2021-03-web-za--KXYX.jpg,c21-2021-03-web-za--Kfcm.jpg,c21-2021-03-web-za--DLFF.jpg,c21-2021-03-web-za--d6cT.jpg",,
5003,1,5,"The Year in the Internet","tyiti","https://www.are.na/the-year-in-the-internet/channels?sort=UPDATED_AT",2020,"Are.na","Cyberspace","Back from the dead, TYITI co-curated w Michael Bell Smith, featuring: Charles Broskoski, Evan Collins, Micaela Durand, Steph Davidson, Nick DeMarco, Benjamin Hickethier, Joel Holmberg, Josie Keefe, Darrel Kennedy, Olia Lialina, Gruppy Lonngergain, Everest Pipkin, Zeff Prize, Meg Miller, David Reinfurt, Laurel Schwulst, NEW MODELS, Joe Williams, Paul Soulellis, C. Spencer Yeh, Damon Zucconi & more.",,,,
4501,1,5,"Freshbuzz","freshbuzz",,2020,"Screen Slate","Cyberspace","Poss a high point 4 me in my 20 year journey as “an artist”, ... 100 ppl watching a screen recorded surf sesh of www.subway.com from 2014 ... online on the legendary Screen (Stream) Slate Twitch. Great convo w Ed Halter after. Thx Rhizome and EAI as well.&nbsp;",,"screenslate-2020-08-web-ih--JE6K.jpg,screenslate-2020-08-web-ih--aqg3.jpg,screenslate-2020-08-web-ih--ta9P.jpg,screenslate-2020-08-web-ih--SuAD.jpg,screenslate-2020-08-web-ih--U4Jm.jpg,screenslate-2020-08-web-ih--XX1d.jpg","[4115] [2013-169-freshbuzz] 2013-169 Freshbuzz",
4503,1,5,"Frieze LA","frieze-la",,2020,"Frieze Art Fair (w Greene Naftali)","LA","​First big show w Greene Naftali. Showed clickfarm works &amp; Ikea table flatware.&nbsp;",,"greene-naftali-frieze-2020--web-ih--TKps.jpg,greene-naftali-frieze-2020--web-ih--rauE.jpg,greene-naftali-frieze-2020--web-ih--Yhjt.jpg,greene-naftali-frieze-2020--web-ih--zumV.jpg,greene-naftali-frieze-2020-XX-web-ih--osaQ.jpg,greene-naftali-frieze-2020-XX-web-ih--uzSr.jpg","[4490] [2020-003-nke] 2020-003 NKE,[4491] [2020-004-workutworutworout] 2020-004 WORKUTWORUTWOROUT,[4492] [2020-006-workout-2018] 2020-006 Workout 2018,[4493] [2020-007-server-cabinet-cooling-everything-you-need-to-know] 2020-007 Server Cabinet Cooling - Everything you need to know,[4494] [2020-008] 2020-008 :-),[4495] [2020-022-when-the-squad] 2020-022 when the squad",
4507,1,5,"New Dawn","new-dawn",,2020,"Louis Vuitton","Global","Did an ad campaign 4 LV - both print &amp; in-store. Decked out their flagships 4 July with dusk &amp; dawns.",,"lv-2020-07-web-sm--CVeL.jpg,lv-2020-07-web-sm--DJFW.jpg,lv-2020-07-web-sm--faVh.jpg,lv-2020-07-web-sm--91eI.jpg","[4497] [2020-031-the-light-of-a-new-dawn] 2020-031 The light of a new dawn",
4470,1,5,"Overwrite","overwrite",,2020,"Greene Naftali Gallery","New York","w/ JULIE BECKER, TONY CONRAD, GUYTON\WALKER, JACQUELINE HUMPHRIES :-)",,"overwrite-2020-07-db-gn--8WxP.jpg,overwrite-2020-07-db-gn--mIpx.jpg,overwrite-2020-07-db-gn--17oR.jpg,overwrite-2020-07-db-gn--f1zQ.jpg,overwrite-2020-07-db-gn--fpf9.jpg,overwrite-2020-07-db-gn--hJxu.jpg,overwrite-2020-07-db-gn--Horf.jpg,overwrite-2020-07-db-gn--hvTy.jpg","[15] [2004-002-f1-racer-mod] 2004-002 F1 Racer Mod (aka Japanese Driving Game)",
4504,1,5,"Arcangel Surfware x DSMLA: Flagship","arcangel-surfware-x-dsmla",,2019,"DSMLA","LA","Built a copy of the Arcangel Surfware scandinavian flagship @ DSMLA…",,"dover-street-market-la-2019-XX-web-fs--1TkK.jpg,dover-street-market-la-2019-XX-web-fs--8jSG.jpg,dover-street-market-la-2019-XX-web-fs--4EwY.jpg,dover-street-market-la-2019-XX-web-fs--8v4e.jpg,dover-street-market-la-2019-XX-web-fs--9XJS.jpg,dover-street-market-la-2019-XX-web-fs--ahgz.jpg,dover-street-market-la-2019-XX-web-fs--dFFK.jpg,dover-street-market-la-2019-XX-web-fs--dgxO.jpg,dover-street-market-la-2019-XX-web-fs--Fe5B.jpg,dover-street-market-la-2019-XX-web-fs--HD9H.jpg,dover-street-market-la-2019-XX-web-fs--IuDK.jpg,dover-street-market-la-2019-XX-web-fs--kPQ7.jpg,dover-street-market-la-2019-XX-web-fs--M8OL.jpg,dover-street-market-la-2019-XX-web-fs--OdUG.jpg,dover-street-market-la-2019-XX-web-fs--RlWL.jpg,dover-street-market-la-2019-XX-web-fs--pf5V.jpg,dover-street-market-la-2019-XX-web-fs--SCQQ.jpg,dover-street-market-la-2019-XX-web-fs--SCQe.jpg,dover-street-market-la-2019-XX-web-fs--vM3E.jpg,dover-street-market-la-2019-XX-web-fs--w9vz.jpg,dover-street-market-la-2019-XX-web-fs--waql.jpg,dover-street-market-la-2019-XX-web-fs--yFRB.jpg,dover-street-market-la-2019-XX-web-fs--yTFm.jpg,dover-street-market-la-2019-XX-web-fs--YFWd.jpg,dover-street-market-la-2019-XX-web-fs--wlKN.jpg,dover-street-market-la-2019-XX-web-fs--ytzy.jpg,dover-street-market-la-2019-XX-web-fs--zPV0.jpg,dover-street-market-la-2019-XX-web-fs--zYwF.jpg,dover-street-market-la-2019-XX-web-ih--imHc.jpg","[4111] [2013-117-the-source-desktop-wireform] 2013-117 The Source Issue 1 Desktop Wireform (SRF-014),[4112] [2013-133-the-source-issue-3-i-shot-andy-warhol] 2013 133 The Source Issue 3 I Shot Andy Warhol (SRF-016),[4113] [2013-168-the-source-issue-4-on-and-on] 2013-168 The Source Issue 4 On and On  (SRF-017),[4114] [2013-138-the-source-pizza-party] 2013 138 The Source Issue 2 Pizza Party (SRF-015),[4138] [2013-115-24-Dances-For-The-Electric-Piano] 2013-015 24 Dances For The Electric Piano (SRF-001),[4140] [2013-221-24-dances-for-electric-piano-drawing-srf-013] 2013-221 24 Dances for Electric Piano (Drawing) (SRF-013),[4211] [2013-136-the-source-issue-5-space-invader] 2013-136 The Source Issue 5 Space Invader  (SRF-20),[4213] [2013-137-the-source-hello-world-pen-plotter] 2013-137 The Source Issue 6  Hello World Pen Plotter (SRF-22),[4214] [2013-140-the-source-issue-7-dooogle] 2013-140 The Source Issue 7 Dooogle  (SRF-23),[4215] [2013-134-the-source-issue-8-six-sixty-six] 2013-134 The Source Issue 8 Six Sixty Six  (SRF-24),[4277] [2014-088-going-negative-lakes] 2014-088 Going Negative / Lakes,[4297] [2015-159-fuck-negativity-sweatpants-srf-027] 2015-159 Fuck Negativity Sweatpants (SRF-027),[4298] [2015-158-fuck-negativity-hoodie-srf-026] 2015-158 Fuck Negativity Hoodie (SRF-026),[4299] [2015-157-fuck-negativity-t-shirt-srf-025] 2015-157 Fuck Negativity T-Shirt (SRF-025),[4305] [2015-164-fuck-negativity-slides-srf-032] 2015-164 Fuck Negativity Slides (SRF-032),[4366] [2016-077-fuck-negativity-white-sweatpants] 2016-077 Fuck Negativity Sweatpants,[4367] [2016-078-fuck-negativity-white-hoodie-srf-035] 2016-078 Fuck Negativity White Hoodie (SRF-035),[4368] [2016-079-fuck-negativity-white-t-shirt-srf-034] 2016-079 Fuck Negativity White T-Shirt (SRF-034),[4378] [2016-061-the-source-digest-srf-038] 2016-061 The Source Digest (SRF-038),[4409] [2013-141-the-source-issue-10-what-a-misunderstanding] 2013-141 The Source  Issue #10: What a misunderstanding!,[4410] [2013-144-the-source-issue-9-colors-personal-edition] 2013-144 The Source Issue #9: Colors Personal Edition,[4451] [2018-052-multi-function-scarf] 2018-052 Multi-function scarf",
4502,1,5,"Arcangel Surfware X NYABF 2019: Flagship","arcangel-surfware-x-nyabf-2019multifunctions",,2019,"NYABF","New York","​Surfware wz back at NYABF! Tiny tiny tiny tiny version of our flagship. Hot tickets: multi-function scarves &amp; “flatware” airplane pillows.",,"nyabf-2019-09-web-ih--Zh3r.jpg,nyabf-2019-09-web-ih--3spL.jpg,nyabf-2019-09-web-ih--KJuk.jpg","[4297] [2015-159-fuck-negativity-sweatpants-srf-027] 2015-159 Fuck Negativity Sweatpants (SRF-027),[4298] [2015-158-fuck-negativity-hoodie-srf-026] 2015-158 Fuck Negativity Hoodie (SRF-026),[4305] [2015-164-fuck-negativity-slides-srf-032] 2015-164 Fuck Negativity Slides (SRF-032),[4306] [2015-162-fuck-negativity-dog-tags-srf-030] 2015-162 Fuck Negativity Dog Tags (SRF-030),[4366] [2016-077-fuck-negativity-white-sweatpants] 2016-077 Fuck Negativity Sweatpants,[4367] [2016-078-fuck-negativity-white-hoodie-srf-035] 2016-078 Fuck Negativity White Hoodie (SRF-035),[4368] [2016-079-fuck-negativity-white-t-shirt-srf-034] 2016-079 Fuck Negativity White T-Shirt (SRF-034),[4451] [2018-052-multi-function-scarf] 2018-052 Multi-function scarf",
4505,1,5,"Arcangel Surfware X Rhizome X New Museum: Flagship","arcangel-surfware-x-rhizome-x-new-museum-flagship",,2019,"New Museum","New York","Built a copy of the Arcangel Surfware Flagship at the New Museum 4 one day! Thx Rhizome.&nbsp;",,"rhizome-flagship-2019-05-web-ih--aFCU.jpg,rhizome-flagship-2019-05-web-ih--ByaI.jpg,rhizome-flagship-2019-05-web-ih--C9Jd.jpg,rhizome-flagship-2019-05-web-ih--ctyY.jpg,rhizome-flagship-2019-05-web-ih--gHca.jpg,rhizome-flagship-2019-05-web-ih--gWVA.jpg,rhizome-flagship-2019-05-web-ih--Kf1f.jpg,rhizome-flagship-2019-05-web-ih--PoVD.jpg,rhizome-flagship-2019-05-web-ih--rCtD.jpg,rhizome-flagship-2019-05-web-ih--RgYi.jpg,rhizome-flagship-2019-05-web-ih--Xa05.jpg,rhizome-flagship-2019-05-web-ih--VmI3.jpg,rhizome-flagship-2019-05-web-ih--xDnP.jpg","[4111] [2013-117-the-source-desktop-wireform] 2013-117 The Source Issue 1 Desktop Wireform (SRF-014),[4112] [2013-133-the-source-issue-3-i-shot-andy-warhol] 2013 133 The Source Issue 3 I Shot Andy Warhol (SRF-016),[4113] [2013-168-the-source-issue-4-on-and-on] 2013-168 The Source Issue 4 On and On  (SRF-017),[4114] [2013-138-the-source-pizza-party] 2013 138 The Source Issue 2 Pizza Party (SRF-015),[4138] [2013-115-24-Dances-For-The-Electric-Piano] 2013-015 24 Dances For The Electric Piano (SRF-001),[4211] [2013-136-the-source-issue-5-space-invader] 2013-136 The Source Issue 5 Space Invader  (SRF-20),[4213] [2013-137-the-source-hello-world-pen-plotter] 2013-137 The Source Issue 6  Hello World Pen Plotter (SRF-22),[4214] [2013-140-the-source-issue-7-dooogle] 2013-140 The Source Issue 7 Dooogle  (SRF-23),[4215] [2013-134-the-source-issue-8-six-sixty-six] 2013-134 The Source Issue 8 Six Sixty Six  (SRF-24),[4297] [2015-159-fuck-negativity-sweatpants-srf-027] 2015-159 Fuck Negativity Sweatpants (SRF-027),[4298] [2015-158-fuck-negativity-hoodie-srf-026] 2015-158 Fuck Negativity Hoodie (SRF-026),[4299] [2015-157-fuck-negativity-t-shirt-srf-025] 2015-157 Fuck Negativity T-Shirt (SRF-025),[4305] [2015-164-fuck-negativity-slides-srf-032] 2015-164 Fuck Negativity Slides (SRF-032),[4366] [2016-077-fuck-negativity-white-sweatpants] 2016-077 Fuck Negativity Sweatpants,[4367] [2016-078-fuck-negativity-white-hoodie-srf-035] 2016-078 Fuck Negativity White Hoodie (SRF-035),[4368] [2016-079-fuck-negativity-white-t-shirt-srf-034] 2016-079 Fuck Negativity White T-Shirt (SRF-034),[4378] [2016-061-the-source-digest-srf-038] 2016-061 The Source Digest (SRF-038),[4409] [2013-141-the-source-issue-10-what-a-misunderstanding] 2013-141 The Source  Issue #10: What a misunderstanding!,[4410] [2013-144-the-source-issue-9-colors-personal-edition] 2013-144 The Source Issue #9: Colors Personal Edition",
4508,1,5,"They told me there would be tea","art-night",,2019,"Art Night @ St Mary's Church","Walthamstow","​Curated an organ night - OF BRAND NEW MUSIC - w Hampus Lindwall. Including: Ellen Arkbro, Pierre Bismuth, Kara-Lis Coverdale, Hanne Lippard, Haroon Mizra, Charlemagne Palestine, as well as world premieres by Hampus &amp; I!",,"art-night-2019-05-web-tb--3v6O.jpg,art-night-2019-05-web-tb--2bDY.jpg,art-night-2019-05-web-tb--8Arx.jpg,art-night-2019-05-web-tb--awSM.jpg,art-night-2019-05-web-tb--BkHI.jpg,art-night-2019-05-web-tb--eYKy.jpg,art-night-2019-05-web-tb--jJ5C.jpg,art-night-2019-05-web-tb--R5tI.jpg,art-night-2019-05-web-tb--zJME.jpg,art-night-2019-06-web-sj--biLs.jpg,art-night-2019-06-web-sj--UMzJ.jpg","[4483] [2019-046-scrubs] 2019-046 Scrubs",
4499,1,5,"BACK OFF","back-off",,2019,"Firstsite","Colchester","Done on dawn of a poss Brexit @ Firstsite kunsthall (notably in Colchester) thus the second of my “asset light” shows (Sharjah wz the first), ... meaning most everything was collected, assembled, and produced quickly &amp; locally - eg. lasers, dolly lights, Ikea tables, etc, etc. Stars aligned on this one, ... turned out killer.",,"firstsite-2019-05-web-da--4O1Z.jpg,firstsite-2019-05-web-da--9SNB.jpg,firstsite-2019-05-web-da--NqdM.jpg,firstsite-2019-05-web-da--CWJD.jpg,firstsite-2019-05-web-da--NNXN.jpg,firstsite-2019-05-web-da--mVZC.jpg,firstsite-2019-05-web-da--mKVx.jpg,firstsite-2019-05-web-da--DtgH.jpg,firstsite-2019-05-web-da--SD14.jpg,firstsite-2019-05-web-da--Qitn.jpg,firstsite-2019-05-web-da--yI2y.jpg,firstsite-2019-05-web-ih--BE9W.jpg,firstsite-2019-05-web-da--JbLc.jpg,firstsite-2019-05-web-da--H6JL.jpg","[36] [2007-003-apple-garageband-autotune] 2007-003 Apple GarageBand Auto Tune Demonstration,[4038] [2005-020-bomb-iraq] 2005-020-Bomb Iraq,[4272] [2014-146-psk] 2014-146 PSK,[4479] [2019-033-high-rise-public-saftey-pink-camo-workout-rothco-xtextile-tactical] 2019-033 HIGH RISE, public saftey, Pink Camo, WORKOUT, Rothco, XTEXTILE, Tactical Work, Y, ORALS BRO,[4480] [2019-036-let] 2019-036 Let,[4481] [2019-037-47-closer] 2019-037 47 Closer",
4465,1,5,"Leaving the Echo Chamber","sharjah-biennial-leaving-the-echo-chamber",,2019,"Sharjah Biennial","Sharjah","Didn’t get the memo artists usually only do one project for biennials like this, and did three :-) Got it together with an outdoor laser, banners on the front of the Sharjah Art Museum, and a pipe organ piece for the Sharjah Radisson gym.",,"dunk-2019-005-db-saf--sLpd.jpg,destroyed-jeans-2018-125-db-saf--wbBE.jpg,destroyed-jeans-2018-125-db-saf--2s34.jpg","[4463] [2018-125-destroyed-jeans] 2018-125 Destroyed Jeans,[4464] [2019-005-dunk] 2019-005 Dunk",
4472,1,5,"Theater of Operations: The Gulf Wars 1991–2011","theater-of-operations-the-gulf-wars-19912011",,2019,"MoMA P.S.1","New York","The good ppl @ Rhizome gave the IRL treatment 2 my 2005 readymade vid game Bomb Iraq",,"theatre-of-war-2019-12-db-ms--l2CF.jpg","[4038] [2005-020-bomb-iraq] 2005-020-Bomb Iraq",
4500,1,5,"Topline","topline",,2019,"CC Foundation","Shanghai","Third ""asset light"" show. Finally got the nerve up 2 do a whole show of the flatware series (uuuuugh, ... took me 10 years!). Def worth the wait I think. Shanghai wz also great.&nbsp;",,"cc-foundation-topline-2019-XX-web-ih--AzKP.jpg,cc-foundation-topline-2019--web-ih--01Cu.jpg,cc-foundation-topline-2019-XX-web-ih--BIV4.jpg,cc-foundation-topline-2019-XX-web-ih--bp6m.jpg,cc-foundation-topline-2019-XX-web-ih--7OwE.jpg,cc-foundation-topline-2019-XX-web-ih--c8vq.jpg,cc-foundation-topline-2019-XX-web-ih--Ikej.jpg,cc-foundation-topline-2019-XX-web-ih--LnAT.jpg,cc-foundation-topline-2019-XX-web-ih--ufM8.jpg,cc-foundation-topline-2019-XX-web-ih--hxWk.jpg,cc-foundation-topline-2019-XX-web-ih--YGeY.jpg,cc-foundation-topline-2019-XX-web-ih--WY2t.jpg","[4484] [2019-042-vyb] 2019-042 VYB,[4485] [2019-048-creibleworkut] 2019-048 CREIBLEWORKUT,[4486] [2019-050-acool] 2019-050 acool,[4487] [2019-054-artney-adid] 2019-054 artney, adid,[4488] [2019-056-ulcycle] 2019-056 ULCYCLE",
4436,1,5,"Verticals","verticals",,2019,"Galerie Thaddaeus Ropac","Salzburg","A classic European show (maybe my last for a while?). Painting, sculpture, drawing, laser ;-)",,"ropac-verticals-2019-01-web-ug--CMTR.jpg,ropac-verticals-2019-01-web-ug--FXib.jpg,ropac-verticals-2019-01-web-ug--dNpQ.jpg,ropac-verticals-2019-01-web-ug--DGZU.jpg,ropac-verticals-2019-01-web-ug--VsVH.jpg,ropac-verticals-2019-01-web-ug--yzY7.jpg,ropac-verticals-2019-01-web-ug--xK98.jpg","[4453] [2018-072-ivyrk] 2018-072 IVYRK,[4454] [2018-072-dukes] 2018-071 Dukes,[4455] [2018-084-fil] 2018-084 FIL,[4456] [2018-084-dunk] 2018-084 Dunk,[4459] [2018-116-untitled] 2018-116 Untitled,[4460] [2018-118-untitled] 2018-118 Untitled,[4461] [2018-121-untitled] 2018-121 Untitled,[4462] [2018-124-the-original] 2018-124 The Original",
4447,1,5,"A Portrait of the Composer","a-portrait-of-the-composer",,2018,"Church Saint-Denys-du-Sacrement","Paris","Hampus Lindwall on the pipes w a few of mine, one by Duchamp (if you blinked, you would have missed it), and one by Niblock. WZ TOTAL FIRE.",,"portrait-2018-10-db-j--Ai78.jpg","[93] [2006-005-sweet16] 2006-005 Sweet 16,[4446] [2018-035-all-the-birds] 2018-035 All the birds",
4424,1,5,"Art in the Age of the Internet, 1989 to Today","art-in-the-age-of-the-internet-1989-to-today",,2018,"ICA Boston","Boston","in d corner w/ Majerus &amp; Catala :)",,"ICA-Boston-2018-03-install-3-database-cm-P29H.jpg","[185] [2005-021-super-landscape-1] 2005-021 Super Landscape #1",
4428,1,5,"Difference Engine","difference-engine",,2018,"Lisson Gallery","New York","​Curated this show w/ Tina Kukielski. Thx 2 Carol Bove, Jacob Ciocci, Aleksandra Domanović, Lonnie Holley, Jamian Juliano-Villani, JODI, Konrad Klapheck, Guthrie Lonergan, Michel Majerus, Jayson Musson, Deborah Remington, Hayley Silverman, Jessie Stead, Paul Thek and Ernest Trova. ","I made the carpet, and had a Juicero on site :-)","difference-engine-2018-06-web-lg--3AkC.jpg,difference-engine-2018-06-web-ih--boGS.jpg,difference-engine-2018-06-web-lg--WSy0.jpg,difference-engine-2018-06-web-ih--d213.jpg,difference-engine-2018-06-web-lg--osHt.jpg,difference-engine-2018-06-web-lg--SfNZ.jpg,difference-engine-2018-06-web-lg--V2lF.jpg,difference-engine-2018-06-web-ih--oqOy.jpg,difference-engine-2018-06-web-lg--FdBW.jpg,difference-engine-2018-06-web-lg--1Pd9.jpg,difference-engine-2018-06-web-lg--4cDw.jpg,difference-engine-2018-06-web-lg--0udS.jpg,difference-engine-2018-06-web-lg--07Cz.jpg,difference-engine-2018-06-web-lg--SJPP.jpg,difference-engine-2018-06-web-lg--lSZD.jpg","[4445] [2018-010-water] 2018-010 Water",
4509,1,5,"Let it be","let-it-be",,2018,"Flagship AS","Stavanger","Curated a small show 4 Flagship AS (the gallery inside Arcangel Surfware’s flagship) with the legendary Steina and Woody Vasulka: Let it be (1970) ",,"flagship-2017-062-web-jih--IXPs.jpg,flagship-2017-062-web-jih--m4dl.jpg,flagship-2017-062-web-jih--tk7V.jpg,flagship-2017-062-web-jih--Uly0.jpg",,
4506,1,5,"Arcangel Surfware Flagship: Grand Opening","arcangel-surfware-flagship-grand-opening",,2017,"Arcangel Surfware Flagship","Stavanger","... this one was out of the blue, but opened a flagship store for Arcangel Surfware on the out-skirts of Stavanger Norway (where I live). Oh yah, we also showed art, and started with Burt Barr’s CLASSIC, Watching The Paint Dry, Red. The flagship wz the EXCLUSIVE POS for Arcangel Surfware during that time (we discarded our web shop) &amp; open 4 2 years every Saturday 12-1500. ",,"flagship-2017-062-web-ih--swyH.jpg,flagship-2017-062-web-jih--1ezT.jpg,flagship-2017-062-web-jih--4K55.jpg,flagship-2017-062-web-jih--4tEb.jpg,flagship-2017-062-web-jih--5SId.jpg,flagship-2017-062-web-jih--7NlM.jpg,flagship-2017-062-web-jih--8Fus.jpg,flagship-2017-062-web-jih--92sM.jpg,flagship-2017-062-web-jih--bLvE.jpg,flagship-2017-062-web-jih--bv4j.jpg,flagship-2017-062-web-jih--D2wl.jpg,flagship-2017-062-web-jih--bWMd.jpg,flagship-2017-062-web-jih--d87z.jpg,flagship-2017-062-web-jih--dEnO.jpg,flagship-2017-062-web-jih--Ekfd.jpg,flagship-2017-062-web-jih--eObU.jpg,flagship-2017-062-web-jih--eyjz.jpg,flagship-2017-062-web-jih--hjqV.jpg,flagship-2017-062-web-jih--IXr5.jpg,flagship-2017-062-web-jih--Kq09.jpg,flagship-2017-062-web-jih--LP9f.jpg,flagship-2017-062-web-jih--m4dl.jpg,flagship-2017-062-web-jih--nQnB.jpg,flagship-2017-062-web-jih--ooB1.jpg,flagship-2017-062-web-jih--OsgQ.jpg,flagship-2017-062-web-jih--qVgr.jpg,flagship-2017-062-web-jih--rrqI.jpg,flagship-2017-062-web-jih--TLmn.jpg,flagship-2017-062-web-jih--uuVY.jpg,flagship-2017-062-web-jih--WDHS.jpg,flagship-2017-062-web-jih--yd3i.jpg,flagship-2017-062-web-jih--YIGx.jpg,flagship-2017-062-web-jih--YsOT.jpg","[4111] [2013-117-the-source-desktop-wireform] 2013-117 The Source Issue 1 Desktop Wireform (SRF-014),[4112] [2013-133-the-source-issue-3-i-shot-andy-warhol] 2013 133 The Source Issue 3 I Shot Andy Warhol (SRF-016),[4113] [2013-168-the-source-issue-4-on-and-on] 2013-168 The Source Issue 4 On and On  (SRF-017),[4114] [2013-138-the-source-pizza-party] 2013 138 The Source Issue 2 Pizza Party (SRF-015),[4138] [2013-115-24-Dances-For-The-Electric-Piano] 2013-015 24 Dances For The Electric Piano (SRF-001),[4211] [2013-136-the-source-issue-5-space-invader] 2013-136 The Source Issue 5 Space Invader  (SRF-20),[4213] [2013-137-the-source-hello-world-pen-plotter] 2013-137 The Source Issue 6  Hello World Pen Plotter (SRF-22),[4214] [2013-140-the-source-issue-7-dooogle] 2013-140 The Source Issue 7 Dooogle  (SRF-23),[4215] [2013-134-the-source-issue-8-six-sixty-six] 2013-134 The Source Issue 8 Six Sixty Six  (SRF-24),[4297] [2015-159-fuck-negativity-sweatpants-srf-027] 2015-159 Fuck Negativity Sweatpants (SRF-027),[4298] [2015-158-fuck-negativity-hoodie-srf-026] 2015-158 Fuck Negativity Hoodie (SRF-026),[4299] [2015-157-fuck-negativity-t-shirt-srf-025] 2015-157 Fuck Negativity T-Shirt (SRF-025),[4305] [2015-164-fuck-negativity-slides-srf-032] 2015-164 Fuck Negativity Slides (SRF-032),[4306] [2015-162-fuck-negativity-dog-tags-srf-030] 2015-162 Fuck Negativity Dog Tags (SRF-030),[4366] [2016-077-fuck-negativity-white-sweatpants] 2016-077 Fuck Negativity Sweatpants,[4367] [2016-078-fuck-negativity-white-hoodie-srf-035] 2016-078 Fuck Negativity White Hoodie (SRF-035),[4368] [2016-079-fuck-negativity-white-t-shirt-srf-034] 2016-079 Fuck Negativity White T-Shirt (SRF-034),[4378] [2016-061-the-source-digest-srf-038] 2016-061 The Source Digest (SRF-038),[4409] [2013-141-the-source-issue-10-what-a-misunderstanding] 2013-141 The Source  Issue #10: What a misunderstanding!,[4410] [2013-144-the-source-issue-9-colors-personal-edition] 2013-144 The Source Issue #9: Colors Personal Edition",
4423,1,5,"Arcangel Surfware X NYABF 2017: currentmood","arcangel-surfware-x-nyabf-2017-currentmood",,2017,"NYABF","New York","​Testing out a “menu” &amp; dropped the Tony Conrad bot, as well as a line of fidget spinners.",,"nyabf-2017-052-detail-database-dt-14149.jpg,nyabf-2017-052-detail-database-dt-8149.jpg,nyabf-2017-052-detail-database-dt-11149.jpg,nyabf-2017-052-detail-database-dt-7149.jpg,nyabf-2017-052-detail-database-dt-13149.jpg,nyabf-2017-052-full-database-dt-1148.jpg,nyabf-2017-052-detail-database-dt-10149.jpg,nyabf-2017-052-detail-database-dt-17149.jpg,nyabf-2017-052-full-database-dt-3148.jpg,nyabf-2017-052-detail-database-dt-2149.jpg,nyabf-2017-052-detail-database-dt-9149.jpg,nyabf-2017-052-detail-database-dt-1149.jpg,nyabf-2017-052-full-database-dt-2148.jpg,nyabf-2017-052-detail-database-dt-3149.jpg","[4364] [2016-076-currentmood] 2016-076 currentmood,[4391] [2017-049-3-celebs-who-treat-their-fans-like-trash] 2017-049 3 Celebs Who Treat Their Fans Like Trash,[4392] [2017-052-arcangel-surfware-x-nyabf-2017-currentmood] 2017-052 Arcangel Surfware x NYABF 2017: currentmood,[4412] [2017-044-on-this-day] 2017-044 On This Day",
