"inv_num","add_credit","url","title","year","display_year","medium","dims","pitch","ps","live_url","youtube","related_code","subheading","download","commission","related"
"2010-022",,"2010-022","Hello World",2010,2010,"CNC bent stainless steel with electro-polish finish and source code",,"Part of the Hello World sculpture series, this sculpture is a steel wire which has been bent by a CNC wire-form machine at random points with one dimension always increasing. The form of the line is randomly generated by software that is available for download, thus each sculpture in the series is unique.",,,,"https://github.com/coryarcangel/Desktop-Wireform",,,,
"2010-021",,"2010-021-bronzer-flash","Bronzer Flash!",2010,2010,"CD & packaging.",,"​Last half hour of NJ trance radio station Pulse 97. Edition of 300. Some Signed. Sold a few, mostly given to friends.",,"https://soundcloud.com/coryarcangel/bronzer-flash",,,,,,
"2010-020",,"2010-020-sorry-i-havent-posted","Sorry I Haven't Posted",2010,2010,"Website",,"​Blog which re-posts the best blog posts of people apologizing for not posting to their blogs",,"http://sorry.coryarcangel.com/",,,,,,
"2010-018",,"2010-018-research-in-motion","Research in Motion (Kinetic Sculpture #1)",2010,2010,"Modified silver dancing stands","70 x 54 x 18 inches ","​Two dancing stands modded to spin at slightly different speeds. ",,,,,,,,
"2010-017",,"2010-017-http-wwwmocanomiorg","http://www.mocanomi.org/",2010,2010,"Modified museum website",,"​MOCA Miami's website re-done in comic sans","​Yes, this <i>IS</i> what the MOCA Miami website looked like during the duration of my show. :)",,,,,,,
"2010-016",,"2010-016-sc00037204","sc00037204",2010,2010,"Pen on All Purpose Security Paper (Grey) #24 bond","11 x 8.5 inches",,,,,,,,,
"2010-015",,"2010-015-sc00035633","sc00035633",2010,2010,"Pen on All Purpose Security Paper (Grey) #24 bond","11 x 8.5 inches",,,,,,,,,
"2010-014",,"2010-014-sc00033529","sc00033529",2010,2010,"Pen on All Purpose Security Paper (Grey) #24 bond","11 x 8.5 inches",,,,,,,,,
"2010-013",,"2010-013-sc0003181a","sc0003181a",2010,2010,"Pen on All Purpose Security Paper (Grey) #24 bond","11 x 8.5 inches",,,,,,,,,
"2010-012",,"2010-012-sc00028f93","sc00028f93",2010,2010,"Pen on All Purpose Security Paper (Grey) #24 bond","11 x 8.5 inches",,,,,,,,,
"2010-011",,"2010-011-sc0002f901","sc0002f901",2010,2010,"Pen on All Purpose Security Paper (Grey) #24 bond","11 x 8.5 inches",,,,,,,,,
"2010-007",,"2010-007-maxell","Maxell",2010,2010,"Chromogenic print",,"​12-inch record covers scanned on an consumer scanner. ",,,,,,,,
"2010-003",,"2010-003-theres-always-one-at-every-party","There's Always One At Every Party",2010,2010,"Youtube video",,"​Seinfeld super-cut of all scenes dealing with Kramer’s coffee table about coffee tables.","I was making a show, and thought it needed some ​Seinfeld,​....so I made this. . :)",,"https://www.youtube.com/watch?v=3QjTPA-Ib9E
",,,,,
"2010-002",,"2010-002-photoshop-cs","Photoshop CS: 84 by 66 inches, 300 DPI, RGB, square pixels, default gradient ""Blue, Red, Yellow"", mousedown y=1350 x=18200, mouseup y=23400 x=18250",2010,2010,"Chromogenic print","84 x 66 inches",,,,,,,,,
"2009-054",,"2009-054-colors-personal-edition","Colors Personal Edition",2009,2009,"OSX Software",,"Software 2 play a quicktime movie one horizontal line of pixels at a time.",,"http://colors-personal-edition.com/",,"https://github.com/coryarcangel/Colors-Personal-Edition",,,,"[33] 2006-004 Colors - 2006-004-colors"
"2009-053",,"2009-053-epic-line-rider-fail","Epic Line Rider Fail",2009,2009,"(~Youtube) video",,"My contribution to the genre of utube ""Line Rider Fails"". ","​Uuuugh, youtube took this one down, so it doesn't make as much sense now, as these line rider fails are kinda a youtube genre, but none the less you can still download it here.&nbsp;",,,,,"arcangel-epic-line-rider-fail-2009-053-video-web.mp4",,
"2009-049",,"2009-049-continuous-partial-awareness-pdf","Continuous Partial Awareness (PDF)",2009,2009,"PDF",,"A list of ideas for artworks, rated. Made originally for a performance. ps - Some I ended up making.",,,,,,"arcangel-CPA.pdf",,"[49] [2008-020-continuous-partial-awareness-performance] 2008-020 Continuous Partial Awareness (Performance)"
"2009-046",,"2009-046-what-a-misunderstanding-art","What a Misunderstanding!",2009,"2009-2014","Tumblr/artist software",,"​New Yorker “Caption This Cartoon” contest always captioned with the phrase “What a misunderstanding!”. Updated every week automatically.",,"http://www.what-a-misunderstanding.com/",,"https://github.com/coryarcangel/What-a-Misunderstanding",,,,"[4409] [2013-141-the-source-issue-10-what-a-misunderstanding] 2013-141 The Source  Issue #10: What a misunderstanding!"
"2009-041",,"2009-041-last-night-i-had-the-strangest-dream","Last Night I Had The Strangest Dream",2009,2009,,,"Me playing folk music and singing through auto-tune. Uuugh.",,,"https://www.youtube.com/watch?v=Kow3MR2kTVs",,,,,"[36] 2007-003 Apple GarageBand Auto Tune Demonstration - appleautotune"
"2009-040",,"2009-040-everybody-else","Everybody Else",2009,2009,"Intro for Digital Folklore Book. ",,"​Txt about digital folklore.",," http://digitalfolklore.org/",,,,,,
"2009-037",,"2009-037-hello-world","Hello World",2009,2009,"Pen on paper",,"​Between 0-100 lines drawn to random points",,,,"https://github.com/coryarcangel/Hp-Pen-Plotter-Hello-World",,,,
"2009-036",,"2009-036-hello-world","Hello World",2009,2009,"Pen on paper",,"​Between 0-100 lines drawn to random points",,,,"https://github.com/coryarcangel/Hp-Pen-Plotter-Hello-World",,,,
"2009-035",,"2009-035-hello-world","Hello World",2009,2009,"Pen on paper",,"​Between 0-100 lines drawn to random points",,,,"https://github.com/coryarcangel/Hp-Pen-Plotter-Hello-World",,,,
"2009-034",,"2009-034-hello-world","Hello World",2009,2009,"Pen on paper",,"​Between 0-100 lines drawn to random points",,,,"https://github.com/coryarcangel/Hp-Pen-Plotter-Hello-World",,,,
"2009-033",,"2009-033-hello-world","Hello World",2009,2009,"Pen on paper",,"​Between 0-100 lines drawn to random points",,,,"https://github.com/coryarcangel/Hp-Pen-Plotter-Hello-World",,,,
"2009-032",,"2009-032-working-on-my-novel","Working On My Novel",2009,2009,"Social network search",,"​Search for “working on my novel” on the social network Twitter.","Original link (which doesn’t work anymore) was: http://twitter.com/#search?q=“working on my novel”, but I have found the original Buzzfeed post where I first thought of the idea. LOL! ;-)","https://web.archive.org/web/20110903012902/http://www.buzzfeed.com/arcangel/great-twitter-searches-volume-1-working-on-my-n",,,"(Twitter Search)",,,"[2205] [2012-066-working-on-my-novel] 2012-066 Working On My Novel (Twitter Feed)
[4127] [2012-037-work-on-my-novel-book] 2012-037 Work On My Novel (book)"
"2009-031",,"2009-031-u2-video","U2 Video",2009,2009,"Youtube video",,"​A home made video for U2, posted on the social network Youtube.",,"http://www.youtube.com/watch?v=PHDMmDgPrt8",,,,,,
"2009-006",,"2009-006-photoshop-cs","Photoshop CS: 84 by 66 inches, 300 DPI, RGB, square pixels, default gradient ""Spectrum"", mousedown y=8900 x=15600, mouseup y=13800 x=0",2009,2009,"Chromogenic print","84 x 66 inches",,,,,,,,,
"2009-004",,"2009-004-photoshop-cs","Photoshop CS: 72 by 110 inches, 300 DPI, RGB, square pixels, default gradient ""Spectrum"", mousedown y=1416 x=1000, mouseup y=208 x=42",2009,2009,"Chromogenic print","72 x 110 inches",,,,,,,,,
